### ISSUE TITLE
multiplayer mode, all signed in but can't see each other

### ISSUE THREAD

**Issue by kanhao100** [zoffline/zwift-offline#394]
Does anyone have experience with this issue?
I'm running a zwift-offline server (VPS with public IP) and have 2 devices connected (Windows and Android). Both can connect to the server successfully, but we can't see each other in-game even when we're in the same location. The player count always shows only 1 person no matter who logs in.
Any suggestions on how to fix this multiplayer visibility problem?
![image](https://github.com/user-attachments/assets/8f862946-1986-45dd-a8f4-17a49e7dcb4b)

Steps I've already tried:
Added `server-ip.txt` with my VPS public IP
Removed enable_bots.txt `rm enable_bots.txt` 
Removed enable_ghosts.txt `rm enable_ghosts.txt `
Restarted the docker container  `docker restart zwift-offline`

**Comment by fatsbrown** [comment]
Look for these entries in Zwift log (https://support.zwift.com/locating-log-files-BykKO63fr)

```
[INFO] TCP disconnected
[INFO] TCP host <IP from server-ip.txt>:3025 (secure)
[INFO] Connecting to TCP server...
[INFO] Saying hello to TCP server (largest wa is 0)
[INFO] UDP host <IP from server-ip.txt>:3024 (secure)
[INFO] Connecting to UDP server with relay id 1...
```

If you see error connecting to TCP/UDP host, it's possible that the ports are not exposed.

**Comment by kanhao100** [comment]
Thank you for the quick response.
Here's what I found in the Zwift log from WSL in my windows:
```bash
root@DESKTOP-8J220GD:/mnt/c/Users/kanhao100/Documents/Zwift/Logs# cat Log.txt | grep -E "UDP|TCP"
[19:45:16] [INFO] TCP disconnected
[19:45:16] [INFO] TCP host <my_vps_ip>:3025 (secure)
[19:45:16] [INFO] Connecting to TCP server...
[19:45:16] [INFO] Saying hello to TCP server (largest wa is 0)
[19:45:16] [ERROR] Error receiving TCP header [2] End of file
[19:45:21] [INFO] TCP disconnected
[19:45:21] [INFO] TCP host <my_vps_ip>:3025 (secure)
[19:45:21] [INFO] Connecting to TCP server...
[19:45:21] [INFO] Saying hello to TCP server (largest wa is 0)
[19:45:22] [ERROR] Error receiving TCP header [2] End of file
[19:45:27] [INFO] TCP disconnected
[19:45:27] [INFO] TCP host <my_vps_ip>:3025 (secure)
[19:45:27] [INFO] Connecting to TCP server...
[19:45:27] [INFO] Saying hello to TCP server (largest wa is 0)
[19:45:27] [ERROR] Error receiving TCP header [2] End of file
[19:45:32] [INFO] TCP disconnected
[19:45:32] [INFO] TCP host <my_vps_ip>:3025 (secure)
[19:45:32] [INFO] Connecting to TCP server...
[19:45:32] [INFO] Saying hello to TCP server (largest wa is 0)
[19:45:32] [ERROR] Error receiving TCP header [2] End of file
[19:45:37] [INFO] TCP disconnected
[19:45:37] [INFO] TCP host <my_vps_ip>:3025 (secure)
[19:45:37] [INFO] Connecting to TCP server...
[19:45:37] [INFO] Saying hello to TCP server (largest wa is 0)
[19:45:37] [ERROR] Error receiving TCP header [2] End of file
```
I have no idea what's it.

I tested the VPS firewall rules from my PC:
```
root@DESKTOP-8J220GD:/mnt/c/Users/kanhao100# nc -zv <my_vps_ip> 443
nc -zv <my_vps_ip> 80
nc -zv <my_vps_ip> 3025
nc -zv -u <my_vps_ip> 3024
Connection to <my_vps_ip> 443 port [tcp/https] succeeded!
Connection to <my_vps_ip> 80 port [tcp/http] succeeded!
Connection to <my_vps_ip> 3025 port [tcp/*] succeeded!
Connection to <my_vps_ip> 3024 port [udp/*] succeeded!
```
All succeeded.

All port connections succeeded. Additionally, I tested the API endpoint:
```
root@DESKTOP-8J220GD:/mnt/c/Users/kanhao100# curl https://<my_vps_ip>:443/api/telemetry/config
curl: (60) SSL certificate problem: self-signed certificate
More details here: https://curl.se/docs/sslcerts.html

# Testing with -k flag to ignore SSL certificate verification
root@DESKTOP-8J220GD:/mnt/c/Users/kanhao100# curl -k https://<my_vps_ip>:443/api/telemetry/config
{"analyticsEvents":true,"batchInterval":120,"innermostCullingRadius":1500,"isEnabled":true,"key":"aXBSdlpza3p1aVlNOENrMTBQSzZEZ004Z2pwRm8zZUE6","remoteLogLevel":3,"sampleInterval":60,"url":"https://us-or-rly101.zwift.com/v1/track","urlBatch":"https://us-or-rly101.zwift.com/hvc-ingestion-service/batch"}
```
The logs show TCP connection issues despite all ports being accessible. Any ideas what might be causing this?

**Comment by fatsbrown** [comment]
Seems to be a network issue, but no idea what can be causing it.

A possibly related issue is #192

**Comment by kanhao100** [comment]
Thank you for your reply. I have two related questions about the connectivity issues:
Does port 3025 use SSL or any other encryption protocol?
I'm experiencing the same issue as #340, but with an interesting observation: When I switched to a different ISP, we can log in successfully, but port 3025 still disconnects. Could these two issues be related?
The fact that changing ISPs affects the connection suggests possible network interference or routing issues. Could you help me understand if there's any connection between these problems?

**Comment by fatsbrown** [comment]
SSL is only used on port 443. Packets transmitted through ports 3025 and 3024/UDP are encrypted, but not the communication protocol itself (encryption/decryption is performed by zoffline and Zwift client).

I agree that it may be network interference or routing issue, #192 is affected by VPN "split tunneling" (ghosts and bots require ports 3024 and 3025, like multiplayer).

**Comment by kanhao100** [comment]
No, I only use IPv4. 
I have used tcpdump to check the packets. I carefully examined the Zwift log files and found that the “Error receiving TCP header [2] End of file” does not always appear; sometimes it just disappears.

I discovered a new issue related to port 3024 UDP. 
Here are the details: 
At the same time, in the Zwift log files:
```
[18:57:07] FPS 25.30, 101756,  9547, -2237
[18:57:08] ERROR LEVEL: [NETWORK] error (8) sending player state
[18:57:09] ERROR LEVEL: [NETWORK] error (8) sending player state
[18:57:10] ERROR LEVEL: [NETWORK] error (8) sending player state
[18:57:11] ERROR LEVEL: [NETWORK] error (8) sending player state
[18:57:12] ERROR LEVEL: [NETWORK] error (8) sending player state
[18:57:13] ERROR LEVEL: [NETWORK] error (8) sending player state
```
in zwift-offline logs:
```
UDPHandler ParseFromString exception: DecodeError('Field number 0 is illegal.')
UDPHandler ParseFromString exception: DecodeError('Field number 0 is illegal.')
UDPHandler ParseFromString exception: DecodeError('Field number 0 is illegal.')
UDPHandler ParseFromString exception: DecodeError('Field number 0 is illegal.')
UDPHandler ParseFromString exception: DecodeError('Field number 0 is illegal.')
UDPHandler ParseFromString exception: DecodeError('Field number 0 is illegal.')
UDPHandler ParseFromString exception: DecodeError('Field number 0 is illegal.')
```
with the command `tcpdump -i any port 3024 -n -X`
```
18:57:10.217258 veth87bacec Out IP 122.97.189.58.26768 > 172.17.0.3.3024: UDP, length 28
        0x0000:  4500 0038 3099 4000 2e11 386c 7a61 bd3a  E..80.@...8lza.:
        0x0010:  ac11 0003 6890 0bd0 0024 72b1 0700 0000  ....h....$r.....
        0x0020:  0200 0600 0000 1939 bf1f 1891 ca85 8cb4  .......9........
        0x0030:  d7b9 7bf3 f584 948d                      ..{.....
18:57:11.208184 eth0  In  IP 122.97.189.58.26768 > 192.168.11.218.3024: UDP, length 28
        0x0000:  4500 0038 309a 4000 2f11 16fd 7a61 bd3a  E..80.@./...za.:
        0x0010:  c0a8 0bda 6890 0bd0 0024 0ad1 0700 0000  ....h....$......
        0x0020:  0200 0600 0000 1aab 810b e7a6 e187 608b  ..............`.
        0x0030:  34f2 1673 64ef f790                      4..sd...
18:57:11.208201 docker0 Out IP 122.97.189.58.26768 > 172.17.0.3.3024: UDP, length 28
        0x0000:  4500 0038 309a 4000 2e11 386b 7a61 bd3a  E..80.@...8kza.:
        0x0010:  ac11 0003 6890 0bd0 0024 2b3f 0700 0000  ....h....$+?....
        0x0020:  0200 0600 0000 1aab 810b e7a6 e187 608b  ..............`.
        0x0030:  34f2 1673 64ef f790                      4..sd...
18:57:11.208206 veth87bacec Out IP 122.97.189.58.26768 > 172.17.0.3.3024: UDP, length 28
        0x0000:  4500 0038 309a 4000 2e11 386b 7a61 bd3a  E..80.@...8kza.:
        0x0010:  ac11 0003 6890 0bd0 0024 2b3f 0700 0000  ....h....$+?....
        0x0020:  0200 0600 0000 1aab 810b e7a6 e187 608b  ..............`.
        0x0030:  34f2 1673 64ef f790                      4..sd...
18:57:12.212122 eth0  In  IP 122.97.189.58.26768 > 192.168.11.218.3024: UDP, length 28
        0x0000:  4500 0038 309b 4000 2f11 16fc 7a61 bd3a  E..80.@./...za.:
        0x0010:  c0a8 0bda 6890 0bd0 0024 fb65 0700 0000  ....h....$.e....
        0x0020:  0200 0600 0000 1bfa 514e b7ac dafb 6c54  ........QN....lT
        0x0030:  fca2 7736 fad7 a1ca                      ..w6....
18:57:12.212147 docker0 Out IP 122.97.189.58.26768 > 172.17.0.3.3024: UDP, length 28
        0x0000:  4500 0038 309b 4000 2e11 386a 7a61 bd3a  E..80.@...8jza.:
        0x0010:  ac11 0003 6890 0bd0 0024 1bd4 0700 0000  ....h....$......
        0x0020:  0200 0600 0000 1bfa 514e b7ac dafb 6c54  ........QN....lT
        0x0030:  fca2 7736 fad7 a1ca                      ..w6....
18:57:12.212153 veth87bacec Out IP 122.97.189.58.26768 > 172.17.0.3.3024: UDP, length 28
        0x0000:  4500 0038 309b 4000 2e11 386a 7a61 bd3a  E..80.@...8jza.:
        0x0010:  ac11 0003 6890 0bd0 0024 1bd4 0700 0000  ....h....$......
        0x0020:  0200 0600 0000 1bfa 514e b7ac dafb 6c54  ........QN....lT
        0x0030:  fca2 7736 fad7 a1ca                      ..w6....
18:57:13.232344 eth0  In  IP 122.97.189.58.26768 > 192.168.11.218.3024: UDP, length 28
        0x0000:  4500 0038 309c 4000 2f11 16fb 7a61 bd3a  E..80.@./...za.:
        0x0010:  c0a8 0bda 6890 0bd0 0024 2d95 0700 0000  ....h....$-.....
        0x0020:  0200 0600 0000 1cbc 31c3 aee4 0485 1d89  ........1.......
        0x0030:  7647 6373 0280 4ee5                      vGcs..N.
18:57:13.232371 docker0 Out IP 122.97.189.58.26768 > 172.17.0.3.3024: UDP, length 28
        0x0000:  4500 0038 309c 4000 2e11 3869 7a61 bd3a  E..80.@...8iza.:
        0x0010:  ac11 0003 6890 0bd0 0024 4e03 0700 0000  ....h....$N.....
        0x0020:  0200 0600 0000 1cbc 31c3 aee4 0485 1d89  ........1.......
        0x0030:  7647 6373 0280 4ee5  
```
Do you have any ideas about it?

**Comment by kanhao100** [comment]
I'm sure there is a bug in the release `zoffline_1.0.136993.exe`. When I run the old version `zoffline_1.0.135674.exe` on my PC in LAN, there are no problems. 
But when I switch to version 1.0.136993, the UDPHandler issue appears.
```
UDPHandler ParseFromString exception: DecodeError('Error parsing message')
UDPHandler ParseFromString exception: DecodeError('Error parsing message')
UDPHandler ParseFromString exception: DecodeError('Error parsing message')
TCPHandler ParseFromString exception: DecodeError('Error parsing message')
INFO:zoffline:10.192.37.118 - - [2024-12-05 19:37:23] "GET /relay/tcp-config HTTP/1.1" 200 136 0.000000
UDPHandler ParseFromString exception: DecodeError('Error parsing message')
UDPHandler ParseFromString exception: DecodeError('Error parsing message')
UDPHandler ParseFromString exception: DecodeError('Error parsing message')
UDPHandler ParseFromString exception: DecodeError('Error parsing message')
UDPHandler ParseFromString exception: DecodeError('Error parsing message')
```

**Comment by fatsbrown** [comment]
> ERROR LEVEL: [NETWORK] error (8) sending player state

These messages are normal, you will see them even with the official server.

> UDPHandler ParseFromString exception: DecodeError('Field number 0 is illegal.')

Try adding 
``` python
print(p.payload.hex())
```
after this line, so we can see the decoded packet payload
https://github.com/zoffline/zwift-offline/blob/65d887f54a8d14d1c1d2d1ea73d09be5ae4e1f10/standalone.py#L617

> I'm sure there is a bug in the release `zoffline_1.0.136993.exe`. When I run the old version `zoffline_1.0.135674.exe` on my PC in LAN, there are no problems.
> But when I switch to version 1.0.136993, the UDPHandler issue appears.

The thing is that there was a change in Zwift update 1.0.135866 (https://github.com/zoffline/zwift-offline/commit/9b8f02dbfe6c43a2713fcef31e1c7944adee0abf), if you use an earlier client with a later server (or vice-versa), it will fail, the client and server versions must match.

**Comment by fatsbrown** [comment]
Yes, when zoffline is updated to a new client version, most times previous client versions still work (with possible missing features) but eventually, previous client versions may stop working. Ideally, when zoffline is updated, the clients should also be updated to the same version.

**Comment by kanhao100** [comment]
This issue and #340 cloud be closed. I've identified the root cause of this issue and #340. 
When using host file entries to directly map domains to IPs, the HTTP headers still contain the original domain information. China's network infrastructure performs deep packet inspection that verifies whether the domain in HTTP headers matches the IP's ICP registration. This explains why connections are being interrupted even when using direct IP addressing.
Solution:
The most effective solution would be to implement a local proxy server that strips or modifies domain-related headers before the requests leave the local network. This should prevent the connection interruptions we're seeing.


```
                           (Local Proxy)
   [Your PC] ^<=======^> [Caddy Server] =========^> [Remote Zwift-Offline]
    Zwift Client      localhost:80/443/3025/3024       Custom Server
```
I've successfully resolved the connection issues using Caddy as a reverse proxy, no more error
maybe I will add some insturctions and bash to this community later, thank you again

here are my Caddyfile:
```
{
    auto_https off
    debug
    log {
        output file caddy.log
        format console
        level DEBUG
    }
}
# HTTPS (443)
:443 {
    # sources: https://github.com/zoffline/zwift-offline/tree/master/ssl
    tls cert-zwift-com.pem key-zwift-com.pem
    @all_hosts host cdn.zwift.com secure.zwift.com launcher.zwift.com us-or-rly101.zwift.com
    handle @all_hosts {
        reverse_proxy {$ZWIFT_IP}:443 {
            header_up Host ""
            transport http {
                #tls_insecure_skip_verify
                tls_server_name "cdn.zwift.com"
            }
        }
    }
}
cdn.zwift.com:80, secure.zwift.com:80, launcher.zwift.com:80, us-or-rly101.zwift.com:80 {
    reverse_proxy {$ZWIFT_IP}:80 {
        header_up Host ""
    }
}
cdn.zwift.com:3024, secure.zwift.com:3024, launcher.zwift.com:3024, us-or-rly101.zwift.com:3024 {
    reverse_proxy {$ZWIFT_IP}:3024 {
        header_up Host ""
    }
}
cdn.zwift.com:3025, secure.zwift.com:3025, launcher.zwift.com:3025, us-or-rly101.zwift.com:3025 {
    reverse_proxy {$ZWIFT_IP}:3025 {
        header_up Host ""
    }
}
```

**Comment by fatsbrown** [comment]
Excellent, thanks for sharing the solution.

Maybe you don't need reverse proxy for ports 3024 and 3025, because they are always reached directly through the IP, even with the official server. The client receives the TCP server IP from https://us-or-rly101.zwift.com/api/users/login, sends the "hello" packet to this IP and receives the UDP server IP in the response.
